{
  "schemaVersion": 1,
  "name": "phone-float",
  "title": "Парящий телефон",
  "description": "Телефон плавно покачивается в воздухе; камера медленно приближается.",
  "durationInFrames": 150,
  "fps": 30,
  "aspectRatios": ["16:9", "1:1", "4:5", "9:16"],
  "slots": [
    {
      "id": "main",
      "type": "any",
      "mesh": "phone-screen",
      "fit": "cover",
      "aspect": 0.4615,
      "description": "Экран телефона, 9:19.5. Подойдёт мобильный скриншот или запись."
    }
  ],
  "camera": {
    "fov": 30,
    "keyframes": [
      { "frame": 0, "position": [0.5, 0.15, 8.6], "target": [0, -0.05, 0] },
      { "frame": 150, "position": [-0.3, 0.1, 7.6], "target": [0, -0.05, 0] }
    ]
  },
  "lights": [
    { "type": "ambient", "intensity": 1.0 },
    { "type": "directional", "intensity": 2.4, "position": [3, 5, 6] },
    { "type": "directional", "intensity": 0.8, "position": [-4, 1, 3], "color": "#ffd9e8" }
  ],
  "background": "radial-gradient(90% 90% at 50% 40%, #ffffff 0%, rgba(255,255,255,0) 60%), linear-gradient(160deg, #e3e9ff 0%, #f6e8f6 100%)"
}
